{
  "packVersion": "1.0.0",
  "generatedAt": "2026-07-22T09:31:23.529Z",
  "generator": "claude-for-oss@0.1.1",
  "structureHash": "0fd342b4dbc98516",
  "root": "/home/crduser/Projects/claude-for-oss",
  "primaryLanguage": "TypeScript",
  "packageManager": "npm",
  "commands": {
    "install": "npm install",
    "test": "npm run test",
    "build": "npm run build",
    "dev": "npm run dev"
  },
  "topLevelDirs": [
    ".claude",
    ".github",
    "action",
    "badges",
    "docs",
    "schema",
    "src",
    "validation"
  ],
  "ciWorkflows": [
    ".github/workflows/ci.yml",
    ".github/workflows/orientation-check.yml"
  ]
}
